{
  "schemaVersion": 1,
  "asOf": "2026-08-11",
  "status": "offline_trusted_time_split_brain_and_fencing_race_rehearsal_ready_production_consensus_gated",
  "purpose": "Define and adversarially rehearse the trusted-time and split-brain boundary required before Mythical can coordinate autonomous company work across more than one scheduler or recovery claimant. The control binds current A-042 packet, A-046 history, A-047 exception, A-048 lease, and A-049 recovery evidence; launches real simultaneous local acquisition and recovery contenders; requires exactly one exclusive winner in each race; ignores worker-local clock authority; applies fixed coordinator time to skewed, delayed, duplicate, partitioned, and healed work; advances recovery fencing monotonically; preserves completion when alerts lag; refuses stale partitions, unsafe token exhaustion, global disable, payload, and external authority; and invokes no scheduled company workflow, grants no cycle credit, and configures no production consensus or trusted-time service.",
  "decisionRefs": ["D-014", "D-017"],
  "riskRefs": ["R-011", "R-013"],
  "workflowRefs": ["A-012", "A-023", "A-030", "A-031", "A-035", "A-041", "A-042", "A-046", "A-047", "A-048", "A-049", "A-050"],
  "authority": {
    "productionConsensusAuthorized": false,
    "productionTrustedTimeAuthorized": false,
    "productionLeaseWriteAuthorized": false,
    "productionRecoveryAuthorized": false,
    "schedulerActivationAuthorized": false,
    "triggerActivationAuthorized": false,
    "packetAdmissionAuthorized": false,
    "packetExecutionAuthorized": false,
    "credentialUseAuthorized": false,
    "networkAccessAuthorized": false,
    "repositoryWriteAuthorized": false,
    "automatedDispatchAuthorized": false,
    "spendAuthorized": false,
    "externalActionAuthorized": false,
    "conversationIsAuthorization": false
  },
  "sourceEvidence": {
    "packetWorkflowId": "A-042",
    "historyWorkflowId": "A-046",
    "alertWorkflowId": "A-047",
    "leaseWorkflowId": "A-048",
    "recoveryWorkflowId": "A-049",
    "packetSourceIds": ["OC-001", "OC-002"],
    "livePacketIdsAndDigestsRequired": true,
    "currentHistoryEvidenceDigestRequired": true,
    "currentAlertEvidenceDigestRequired": true,
    "currentLeaseEvidenceDigestRequired": true,
    "currentRecoveryEvidenceDigestRequired": true,
    "packetPayloadPermitted": false,
    "scheduledCompanyWorkflowInvocationPermitted": false
  },
  "coordinationPolicy": {
    "decisionSchemaVersion": 1,
    "digestAlgorithm": "sha256",
    "trustedClockSource": "fixed_rehearsal_coordinator_time_only",
    "coordinatorObservedAt": "2026-08-11T15:00:00.000Z",
    "maximumWorkerClockSkewSeconds": 120,
    "maximumEventDelaySeconds": 300,
    "maximumConcurrentHolderCount": 1,
    "acquisitionContenderCount": 8,
    "recoveryContenderCount": 4,
    "maximumRaceMilliseconds": 3000,
    "fencingTokenMaximumSafeInteger": 9007199254740991,
    "workerClockMayDecideExpiry": false,
    "staleReplicaMayWrite": false,
    "partitionedDuplicateMayAcquire": false,
    "completedDelayedTriggerMayReexecute": false,
    "automaticRecoveryAtTokenMaximumPermitted": false,
    "globalDisableCheckedImmediatelyBeforeEffect": true,
    "fencingTokenMustIncrease": true,
    "externalActionAuthorized": false,
    "sensitivePayloadIncluded": false,
    "decisionFields": ["schemaVersion", "decisionId", "packetId", "packetContentDigestSha256", "historyEvidenceDigestSha256", "alertEvidenceDigestSha256", "leaseEvidenceDigestSha256", "recoveryEvidenceDigestSha256", "coordinatorObservedAt", "workerObservedAt", "decision", "fencingToken", "externalActionAuthorized", "sensitivePayloadIncluded"]
  },
  "scenarioPlan": {
    "scenarioCount": 10,
    "scenarios": [
      { "sequence": 1, "id": "TS-001", "fault": "eight_simultaneous_acquisition_claimants", "expectedOutcome": "exactly_one_acquisition_winner" },
      { "sequence": 2, "id": "TS-002", "fault": "worker_clock_positive_skew", "expectedOutcome": "coordinator_time_keeps_valid_lease_active" },
      { "sequence": 3, "id": "TS-003", "fault": "worker_clock_negative_skew", "expectedOutcome": "coordinator_time_expires_lease" },
      { "sequence": 4, "id": "TS-004", "fault": "delayed_trigger_after_completion", "expectedOutcome": "completed_replay_suppressed" },
      { "sequence": 5, "id": "TS-005", "fault": "partitioned_duplicate_before_completion", "expectedOutcome": "partitioned_overlap_refused" },
      { "sequence": 6, "id": "TS-006", "fault": "four_simultaneous_recovery_claimants", "expectedOutcome": "exactly_one_recovery_winner_with_fence_five" },
      { "sequence": 7, "id": "TS-007", "fault": "old_partition_heals_after_recovery", "expectedOutcome": "stale_partition_effect_refused" },
      { "sequence": 8, "id": "TS-008", "fault": "completion_record_precedes_delayed_alert", "expectedOutcome": "completion_preserved_alert_pending" },
      { "sequence": 9, "id": "TS-009", "fault": "fencing_token_at_maximum_safe_integer", "expectedOutcome": "automatic_recovery_refused_token_exhausted" },
      { "sequence": 10, "id": "TS-010", "fault": "global_disable_between_admission_and_effect", "expectedOutcome": "effect_refused_global_disable" }
    ],
    "expectedPassedScenarioCount": 10,
    "expectedAcquisitionWinnerCount": 1,
    "expectedAcquisitionLoserCount": 7,
    "expectedRecoveryWinnerCount": 1,
    "expectedRecoveryLoserCount": 3,
    "expectedClockSkewCaseCount": 2,
    "expectedWorkerClockOverrideIgnoredCount": 2,
    "expectedDelayedTriggerSuppressionCount": 1,
    "expectedPartitionedDuplicateRefusalCount": 1,
    "expectedStalePartitionRefusalCount": 1,
    "expectedCompletionPreservedCount": 1,
    "expectedTokenExhaustionRefusalCount": 1,
    "expectedGlobalDisableEffectBlockCount": 1
  },
  "refusalPlan": {
    "scenarioCount": 16,
    "expectedRefusalCount": 16,
    "scenarios": [
      { "id": "TR-001", "mutation": "unknown_packet", "expectedReasonCode": "packet_binding_mismatch" },
      { "id": "TR-002", "mutation": "substitute_packet_digest", "expectedReasonCode": "packet_binding_mismatch" },
      { "id": "TR-003", "mutation": "substitute_history_evidence", "expectedReasonCode": "source_evidence_mismatch" },
      { "id": "TR-004", "mutation": "substitute_alert_evidence", "expectedReasonCode": "source_evidence_mismatch" },
      { "id": "TR-005", "mutation": "substitute_lease_evidence", "expectedReasonCode": "source_evidence_mismatch" },
      { "id": "TR-006", "mutation": "substitute_recovery_evidence", "expectedReasonCode": "source_evidence_mismatch" },
      { "id": "TR-007", "mutation": "invalid_coordinator_time", "expectedReasonCode": "trusted_time_invalid" },
      { "id": "TR-008", "mutation": "worker_time_as_authority", "expectedReasonCode": "worker_time_not_authoritative" },
      { "id": "TR-009", "mutation": "invalid_decision", "expectedReasonCode": "decision_invalid" },
      { "id": "TR-010", "mutation": "remove_required_field", "expectedReasonCode": "decision_fields_invalid" },
      { "id": "TR-011", "mutation": "add_payload_field", "expectedReasonCode": "decision_fields_invalid" },
      { "id": "TR-012", "mutation": "stale_fencing_token", "expectedReasonCode": "fencing_token_stale" },
      { "id": "TR-013", "mutation": "unsafe_fencing_token", "expectedReasonCode": "fencing_token_unsafe" },
      { "id": "TR-014", "mutation": "authorize_external_action", "expectedReasonCode": "authority_or_payload_flag_invalid" },
      { "id": "TR-015", "mutation": "mark_sensitive_payload", "expectedReasonCode": "authority_or_payload_flag_invalid" },
      { "id": "TR-016", "mutation": "global_disable_active", "expectedReasonCode": "global_disable_active" }
    ]
  },
  "rehearsalStore": {
    "kind": "operating_system_temporary_exclusive_create_race_and_decision_records",
    "outsideRepositoryRequired": true,
    "directoryMode": "0700",
    "recordMode": "0600",
    "exclusiveCreateRequired": true,
    "recordsRemovedAfterRun": true,
    "countsAsProductionConsensus": false,
    "countsAsEligibleCycle": false,
    "productionConsensusConfigured": false
  },
  "productionConsensusPolicy": {
    "providerSelected": false,
    "consensusRef": null,
    "trustedTimeRef": null,
    "schedulerIdentityConfigured": false,
    "workerIdentityConfigured": false,
    "recoveryIdentityConfigured": false,
    "fencingStoreConfigured": false,
    "linearizabilityVerified": false,
    "partitionSafetyVerified": false,
    "clockSkewVerified": false,
    "tokenExhaustionPolicyApproved": false,
    "globalDisableConfigured": false,
    "durableCompletionStoreConfigured": false,
    "authenticatedAlertRouteConfigured": false,
    "backupRestoreVerified": false,
    "regionalFailureVerified": false
  },
  "activationGates": [
    { "id": "TS-G01", "gate": "D-017 records the operating cell, scheduler owner, backup, urgent recipient, recovery operator, kill operator, and selected runtime and coordination classes", "satisfied": false },
    { "id": "TS-G02", "gate": "The provider, account, region, consensus primitive, trusted-time source, failure domains, recovery objectives, service objectives, and exact cost are selected and approved", "satisfied": false },
    { "id": "TS-G03", "gate": "Separated least-privilege scheduler, worker, recovery, kill, history, alert, time, and independent assurance identities are attested, monitored, and revocable", "satisfied": false },
    { "id": "TS-G04", "gate": "Lease acquisition, renewal, release, completion, replay suppression, recovery, and fencing-token allocation are linearizable across every selected service and region", "satisfied": false },
    { "id": "TS-G05", "gate": "Trusted time, monotonic time, clock skew, NTP failure, delayed events, expiry, DST, leap behavior, and cross-service timestamps are approved and tested", "satisfied": false },